{
  "schema_version": "lily_hypothesis_registry_v1",
  "updated": "2026-07-15",
  "evidence_tiers": {
    "E0": "Infrastructure, synthetic evidence, fixtures, or operational dry run; no edge claim.",
    "E1": "Real-data diagnostic evidence that is under-sampled, underpowered, or gate-blocked.",
    "E2": "Validation-grade evidence passing preregistered statistics, regimes, robustness, costs, and adversarial review.",
    "E3": "E2 plus operational validation, account feasibility, and a separate launch checklist."
  },
  "family_stop_rule": {
    "threshold": 3,
    "unit": "consecutive_distinct_edge_or_mechanism_hypotheses",
    "requires_adequate_falsification_sample": true,
    "requires_mechanism_autopsy": true,
    "excluded": [
      "L-0 feasibility",
      "engineering failures",
      "broker permission failures",
      "data pipeline failures"
    ],
    "outcome": "mandatory_family_review"
  },
  "inference_policy": {
    "raw_trade_counts_assumed_independent": false,
    "required": [
      "autocorrelation-adjusted Sharpe variance",
      "calendar observation counts",
      "trade counts",
      "independent-bet-equivalent counts",
      "reported lag conventions",
      "PSR for Sharpe inference",
      "DSR or an explicit blocker when search occurred"
    ]
  },
  "hypotheses": [
    {
      "id": "L-0",
      "family": "sizing_feasibility",
      "counts_toward_family_stop": false,
      "status": "scope_restricted",
      "statement": "At least one globally diversified US-listed fractional-ETF trend implementation is honestly sizeable at USD 1,000 and USD 2,000 after broker constraints and costs, and the same study can identify minimum viable capital for 4-, 8-, and 12-market micro-futures variants.",
      "economic_rationale": "A statistical edge has no operational value when share or contract granularity, margin, cash buffers, costs, or concentration prevent risk-targeted breadth.",
      "testable_predictions": [
        "Fractional ETFs permit materially finer risk allocation than futures at current capital.",
        "Eight to twelve global economic sleeves are feasible at current capital only when fractional execution and minimum-trade rules permit risk-balanced allocation.",
        "Minimum viable micro-futures capital rises with breadth, cash buffer, and volatility stress."
      ],
      "validation_criteria": [
        "Preregister target risk, concentration, cash buffer, minimum trade, annualized cost, and broker-capability thresholds before measurement.",
        "Classify USD 1,000 and USD 2,000 separately without a strategy return backtest.",
        "Report micro-futures minimum capital for 4, 8, and 12 markets using one-contract granularity and stressed margin."
      ],
      "falsification_criteria": [
        "Kill the current-capital claim if no broker-realistic ETF configuration meets all locked breadth, cash-buffer, concentration, minimum-trade, and annualized-cost thresholds at either USD 1,000 or USD 2,000.",
        "A single broker or API capability failure is a scope constraint unless every preregistered implementation path fails."
      ],
      "required_data": [
        "ETF price, volatility, liquidity, inception, currency, and fractional eligibility data.",
        "Webull Thailand fees, fractional rules, API capability, and sandbox/account eligibility.",
        "IBKR account-reported permissions, fees, and API capability.",
        "Micro and full-size futures multipliers, tick values, initial/maintenance margins, and stressed margin ranges."
      ],
      "mintrl_falsify": {
        "status": "not_applicable_deterministic_feasibility",
        "replacement": "locked scenario and stress grid"
      },
      "mintrl_validate": {
        "status": "not_applicable_deterministic_feasibility",
        "replacement": "locked scenario and stress grid"
      },
      "known_kill_zones": [
        "integer contract granularity",
        "margin expansion",
        "fractional API unavailable",
        "cost floor",
        "insufficient breadth",
        "cash-buffer breach"
      ],
      "dependencies": [
        "B0 governance bootstrap",
        "B1 data layer"
      ],
      "evidence": [
        {
          "path": "reports/feasibility/l_0_sizing_feasibility.json",
          "evidence_tier": "E0"
        },
        {
          "path": "reports/feasibility/l_0_webull_th_read_only_capability.json",
          "evidence_tier": "E0"
        },
        {
          "path": "reports/feasibility/l_0_webull_th_fractional_preview.json",
          "evidence_tier": "E0"
        },
        {
          "path": "reports/feasibility/l_0_webull_th_fractional_preview_v2.json",
          "evidence_tier": "E0"
        }
      ],
      "decision_log": [
        {
          "date": "2026-07-15",
          "decision": "activated_at_founding",
          "notes": "Owner capital is USD 1,000-2,000; Webull Thailand is the ETF candidate and IBKR is the micro-futures reference."
        },
        {
          "date": "2026-07-15",
          "decision": "scope_restricted_after_locked_E0_feasibility_study",
          "notes": "Eight- and ten-sleeve ETF economic sizing passes at USD 1,000 and USD 2,000, while twelve sleeves breach the locked 25% weight cap. No broker path is fully verified because exact fractional eligibility, Thailand OpenAPI capability, funding FX, or account permissions remain unknown. Micro-futures minimum capital is USD 40,600, 54,200, and 95,400 for 4, 8, and 12 markets; no edge or deployment claim is made."
        },
        {
          "date": "2026-07-15",
          "decision": "B4_6_webull_th_read_only_and_fractional_metadata_verified",
          "notes": "The owner's Webull Thailand production application passed authentication, account-list, balance, and positions read-only calls. All ten locked ETF candidates returned status OC and fractionable true. L-0 remains scope-restricted because minimum order, funding FX, execution quality, and realized costs were not tested; no preview, order, paper trade, edge, E2, validation unlock, or real-money action is authorized."
        },
        {
          "date": "2026-07-20",
          "decision": "B4_10_fractional_preview_machinery_locked_not_executed",
          "notes": "Gate l_0_webull_th_fractional_preview_probe_v1 hash-locks the fail-closed runner, exact Thailand UAT VTI quantity grid, request guard, report validator, and three synthetic fixtures. B4.10 made no broker, provider, authentication, preview, order, or validation request. A separate owner-approved B4.11 activation gate is required before credential access or execution; L-0 remains scope-restricted E0."
        },
        {
          "date": "2026-07-20",
          "decision": "B4_11_activation_locked_execution_pending_uat_variables",
          "notes": "The owner explicitly approved one bounded Webull Thailand UAT preview execution. Gate l_0_webull_th_fractional_preview_activation_v1 is hash-locked before credential or network access, but all three required WEBULL_UAT variables are absent. No API request occurred; L-0 remains scope-restricted E0."
        },
        {
          "date": "2026-07-20",
          "decision": "B4_11_execution_blocked_before_preview_by_authentication_cap",
          "notes": "The one authorized run used the official shared UAT credential row in process memory only. Token create plus two token checks consumed the locked three-request authentication budget; the guard blocked the fourth authentication attempt. No preview, order, production, provider, or validation request occurred. The result establishes no fractional minimum and L-0 remains scope-restricted E0."
        },
        {
          "date": "2026-07-20",
          "decision": "B4_12_superseding_authentication_budget_gate_locked_before_execution",
          "notes": "Gate l_0_webull_th_fractional_preview_activation_v2 preserves the B4.10/B4.11 artifacts and funds one token create plus at most seven token checks over a fixed 30-second SDK polling window. The VTI quantity grid and all production, order, privacy, provider, validation, claim, and zero-spend boundaries remain unchanged. No B4.12 network request has occurred at the gate stage; L-0 remains scope-restricted E0."
        },
        {
          "date": "2026-07-20",
          "decision": "B4_12_execution_blocked_before_preview_after_30_second_authentication_window",
          "notes": "After the v2 gate commit and CI passed, the one authorized run made one token-create and seven token-check requests. Authentication remained non-NORMAL at 30 seconds, so no preview, order, production, provider, or validation request occurred. The result does not establish whether any VTI quantity is accepted and L-0 remains scope-restricted E0."
        }
      ]
    },
    {
      "id": "L-1",
      "family": "baseline_continuation",
      "counts_toward_family_stop": true,
      "status": "scope_restricted",
      "statement": "A 60-day directional-count baseline has positive convex payoff after implementable costs on the selected global research universe.",
      "economic_rationale": "Slow information diffusion followed by herding can produce continuation, while the system accepts frequent small losses to retain infrequent large trends.",
      "testable_predictions": [
        "Net performance is driven by right-tail trend episodes rather than hit rate.",
        "Whipsaw and mean-reverting regimes are the primary loss zone.",
        "The result survives removal of the best market and best trend episode."
      ],
      "validation_criteria": [
        "Positive implementable net return and preregistered convexity/right-tail criteria.",
        "PSR passes against zero and a matched implementable benchmark; DSR passes or is blocked explicitly if search occurred.",
        "Actual independent-bet-equivalent count meets MinTRL_validate and required regime coverage or explicit scope restrictions."
      ],